Restaurant Name;Restaurant Type;Restaurant Area;Restaurant Rating;Restaurant Review;Restaurant Address;Latitude;Longitude;Price
Onokabe;['Casual Dining', 'Japanese'];Serpong Utara;3.8;1,004 Reviews;Alam Sutera Town Center, Jl. Alam Utama, Serpong Utara, Tangerang;-62.417.640.000;106.652.677.000;Rp100.000 for two people (approx.)
Kikugawa;['Casual Dining', 'Japanese', 'Sushi'];Cikini;4.5;501 Reviews;Jl. Cikini 4 No. 13, Cikini, Jakarta;-61.933.400.000;106.837.795.000;Rp300.000 for two people (approx.)
Dope Burger & Co.;['Casual Dining', 'Burger'];Menteng;4.3;774 Reviews;Jl. Teuku Cik Ditiro No. 25, Menteng, Jakarta;-61.971.070.000;106.837.075.000;Rp250.000 for two people (approx.) Without alcohol
Bistecca;['Casual Dining', 'Steak', 'Italian'];SCBD;4.4;492 Reviews;18 Parc SCBD, Tower C, Lantai Ground, Jl. Jenderal Sudirman Kav 52-53, SCBD, Jakarta;-62.301.466.870;106.810.180.060;Rp250.000 for two people (approx.)
Mottomoo;['Casual Dining', 'Japanese'];SCBD;4.3;1,023 Reviews;Pacific Place Mall, Lantai 5, Jl. Jenderal Sudirman, SCBD, Jakarta;-62.258.114.882;106.809.755.936;Rp850.000 for two people (approx.) Without alcohol
Talaga Sampireun;['Casual Dining', 'Sunda', 'Indonesian'];Ancol;4.3;3,848 Reviews;Taman Impian Jaya Ancol, Jl. Lapangan Golf 7, Ancol, Jakarta;-61.264.220.000;106.833.536.000;Rp250.000 for two people (approx.)
Kluwih Sunda Authentic;['Casual Dining', 'Indonesian'];Bogor Timur;4.4;766 Reviews;Jl. Bina Marga I No. 12, Bogor Timur, Bogor;-66.028.730.000;106.810.907.000;Beautiful View
Paradigma;['Café', 'Coffee', 'Indonesian'];Cikini;3.8;578 Reviews;Jl. Pegangsaan Barat No. 4, Cikini, Jakarta;-61.974.340.000;106.839.832.000;Rp200.000 for two people (approx.)
OSO Ristorante;['Fine Dining', 'Italian'];Thamrin;4.3;294 Reviews;Altitude - The Plaza, Lantai 46, Jl. M. H. Thamrin Kav. 28-30, Thamrin, Jakarta 10350;-61.934.260.000;106.821.924.000;Rp200.000 for two people (approx.)
Sleepyhead Coffee;['Café', 'Cafe'];Senopati;4.2;376 Reviews;Jl. Gunawarman No. 63, Senopati, Jakarta 12180;-62.377.604.453;106.807.551.495;Rp600.000 for two people (approx.) Without alcohol
Latteria Gelato and Dessert Bar;['Dessert Parlor', 'Desserts', 'Ice Cream'];Pantai Indah Kapuk;4.6;1,280 Reviews;Ruko Crown Golf, Blok D No. 39, Bukit Golf Mediterania, Jl. Marina Indah Raya, Pantai Indah Kapuk, Jakarta;-61.113.249.700;106.738.382.019;Rp100.000 for two people (approx.)
Kayu Kayu Restaurant;['Casual Dining', 'Indonesian'];Pinang;3.9;654 Reviews;Jl. Jalur Sutera No. 28A, Pinang, Tangerang;-62.331.770.053;106.660.175.174;Rp100.000 for two people (approx.)
Walking Drums;['Café', 'Indonesian'];Blok M;4.2;655 Reviews;Jl. Pati Unus Blok F4, Blok M, Jakarta;-62.354.480.000;106.795.941.000;Rp300.000 for two people (approx.) Without alcohol
;;;;;;;;Rp150.000 for two people (approx.)
