Restaurant Name;Restaurant Type;Restaurant Area;Restaurant Rating;Restaurant Review;Restaurant Address;Latitude;Longitude;Price
Hause Rooftop;['Casual Dining', 'Bar', 'Western', 'Coffee', 'Tea'];Setiabudi;4.3;1,282 Reviews;MD Place Bulding, Lantai 6, Jl. Setiabudi Selatan No. 7, Kuningan, Jakarta;-62.081.643.570;106.828.454.285;Rp370.000 for two people (approx.) Without alcohol
The Neighbourhood;['Fine Dining', 'Indonesian'];Dharmawangsa;4.4;770 Reviews;Jl. Cipaku I No. 85, Dharmawangsa, Jakarta 12170;-62.395.528.820;106.814.613.081;Rp500.000 for two people (approx.) Without alcohol
SKYE;['Fine Dining', 'Lounge', 'Fusion', 'European', 'Asian'];Thamrin;4.3;2,827 Reviews;Menara BCA, Lantai 56, Jl. MH. Thamrin, Thamrin, Jakarta;-61.967.130.000;106.822.580.000;Breathtaking View
WAKI Japanese BBQ Dining;['Casual Dining', 'Japanese', 'BBQ'];Thamrin;4.9;2,995 Reviews;Lantai 1, Jl. Tanjung Karang No. 5, Thamrin, Jakarta;-62.011.260.000;106.822.306.000;Rp300.000 for two people (approx.) Without alcohol
3 Wise Monkeys;['Casual Dining', 'Japanese', 'Sushi'];Senopati;4.2;2,091 Reviews;Jl. Senopati No. 46, Senopati, Jakarta;-62.311.835.698;106.808.081.232;Rp450.000 for two people (approx.) Without alcohol
GIOI;['Casual Dining', 'Asian'];Senopati;4.8;1,287 Reviews;Jl. Senopati Raya No. 88, Senopati, Jakarta 12190;-62.329.230.352;106.811.388.060;Rp550.000 for two people (approx.) Without alcohol
Bottega Ristorante;['Casual Dining', 'Bar', 'Italian'];SCBD;4.1;1,366 Reviews;Fairgrounds, SCBD Lot 14, Jl. Jenderal Sudirman, SCBD, Jakarta 12190;-62.263.060.000;106.807.505.000;Faster Food Service
Twinhouse;['Casual Dining', 'Asian', 'Western', 'Italian'];Fatmawati;4.3;1,030 Reviews;Jl. Cipete Raya No. 4B, Fatmawati, Jakarta;-62.786.330.000;106.804.856.000;Rp250.000 for two people (approx.)
Toodz House;['Café', 'Casual Dining', 'Coffee', 'Italian', 'Asian'];Fatmawati;4.6;2,606 Reviews;Jl. Cipete Raya No. 79, Fatmawati, Jakarta;-62.779.000.000;106.801.808.000;Rp240.000 for two people (approx.)
Okuzono;['Casual Dining', 'Japanese'];Senopati;4.4;1,095 Reviews;Jl. Suryo No. 1, Senopati, Jakarta;-62.336.152.869;106.812.021.397;Rp300.000 for two people (approx.) Without alcohol
SIKU;['Casual Dining', 'Desserts', 'Indonesian', 'American', 'Coffee', 'Tea'];Dharmawangsa;4.1;916 Reviews;Jl. Dharmawangsa X No. 120A, Dharmawangsa, Jakarta;-62.576.242.210;106.800.790.987;Not very Crowded
The Edge;['Casual Dining', 'Asian', 'Grill'];Kemang;3.8;869 Reviews;Kemang Icon Building, Lantai 5, Jl. Kemang Raya I, Kemang, Jakarta;-62.558.618.413;106.815.133.430;Rp450.000 for two people (approx.) Without alcohol
Tucano's Churrascaria - Brazilian BBQ & Buffet;['Casual Dining', 'Steak', 'Grill', 'BBQ', 'South American'];Sudirman;4.7;769 Reviews;Pavilion Retail Arcade, Lantai Dasar, Jl. K.H Mas Mansyur, Sudirman, Jakarta;-62.079.620.378;106.817.726.790;Rp500.000 for two people (approx.) Without alcohol
Bunga Rampai;['Fine Dining', 'Indonesian'];Menteng;4.5;1,167 Reviews;Jl. Teuku Cik Ditiro No. 35, Menteng, Jakarta;-61.985.180.000;106.837.351.000;Rp750.000 for two people (approx.) Without alcohol
Sofia at The Gunawarman;['Casual Dining', 'Western', 'European', 'Asian'];Senopati;4.2;1,092 Reviews;The Gunawarman, Jl. Gunawarman No. 3, Senopati, Jakarta 12110;-62.320.558.029;106.807.750.314;Rp700.000 for two people (approx.) Without alcohol
MammaRosy;['Casual Dining', 'Italian', 'Pizza'];Kemang;4.3;1,433 Reviews;Jl. Kemang Raya No. 58, Kemang, Jakarta;-62.635.430.000;106.815.788.000;Rp300.000 for two people (approx.) Without alcohol
Blue Jasmine;['Casual Dining', 'Peranakan', 'Indonesian'];Blok M;4.3;707 Reviews;The Maja, Jl. Kyai Maja No. 39, Blok M, Jakarta;-62.410.583.508;106.789.364.107;Rp400.000 for two people (approx.) Without alcohol
Odysseia;['Casual Dining', 'Desserts', 'European', 'Indonesian'];SCBD;4.0;1,010 Reviews;Pacific Place Mall, Lantai South Lobby, Jl. Jenderal Sudirman, SCBD, Jakarta;-62.261.190.000;106.809.930.000;Good Quality Food
Le Quartier;['Casual Dining', 'Wine Bar', 'French', 'Western'];Senopati;4.6;1,228 Reviews;Jl. Gunawarman No. 34, Senopati, Jakarta;-62.377.367.816;106.807.217.560;Rp500.000 for two people (approx.) Without alcohol
Lawless Burgerbar;['Casual Dining', 'Burger'];Kemang;4.7;1,893 Reviews;Jl. Kemang Selatan VIII No. 67H-67I, Kemang, Jakarta;-62.679.110.938;106.814.406.551;Rp150.000 for two people (approx.) Without alcohol
Henshin - The Westin Jakarta;['Fine Dining', 'Bar', 'Peruvian', 'Japanese'];Kuningan;4.5;996 Reviews;The Westin Jakarta, Lantai 67-69, Jl. H. R. Rasuna Said, Kuningan, Jakarta 12940;-62.242.916.437;106.833.816.692;Rp1.400.000 for two people (approx.) Without alcohol
Kashiwa;['Casual Dining', 'Bar', 'Japanese'];Melawai;4.3;1,091 Reviews;Jl. Melawai 8 No. 2A, Melawai, Jakarta;-62.449.631.508;106.799.346.953;Rp250.000 for two people (approx.) Without alcohol
On Three;['Café', 'Cafe', 'Desserts', 'Coffee', 'Tea'];SCBD;4.2;783 Reviews;Senopati Suites 3, 3rd Floor, Jl. Senopati Raya 41, Kebayoran Baru, RT.8/RW.2, Senayan, Kec. Kby. Baru, Kota Jakarta Selatan, Daerah Khusus Ibukota Jakarta;-62.294.101.023;106.802.603.825;Rp150.000 for two people (approx.)
Sushi Hiro;['Casual Dining', 'Japanese'];Senopati;4.6;6,841 Reviews;Jl. Suryo No. 24, Senopati, Jakarta;-62.352.284.263;106.813.301.146;Rp400.000 for two people (approx.)
Lemongrass;['Casual Dining', 'Peranakan', 'Indonesian', 'Dimsum'];Bogor Utara;4.1;2,065 Reviews;Jl. Raya Pajajaran No. 21, Bogor Utara, Bogor;-65.767.095.881;106.808.047.033;Rp250.000 for two people (approx.) Without alcohol
Lucy in the Sky;['Lounge', 'Casual Dining', 'Western', 'Asian'];SCBD;4.0;1,110 Reviews;Fairgrounds, SCBD Lot 14, Jl. Jenderal Sudirman, SCBD, Jakarta;-62.264.180.000;106.807.119.000;Rp400.000 for two people (approx.) with alcohol
Lucky Cat Coffee & Kitchen;['Café', 'Casual Dining', 'Cafe', 'Western'];Kuningan;4.2;1,694 Reviews;Plaza Festival, South Parking, Jl. H.R. Rasuna Said, Kuningan, Jakarta;-62.219.895.377;106.833.554.171;Rp300.000 for two people (approx.)
Daitokyo Sakaba;['Quick Bites', 'Japanese', 'Ramen'];Melawai;4.3;1,280 Reviews;Jl. Melawai 9 No. 26, Melawai, Jakarta;-62.455.444.022;106.800.359.152;Casual Seating Area
Plataran Menteng;['Fine Dining', 'Indonesian'];Menteng;4.4;915 Reviews;Jl. HOS. Cokroaminoto No. 42, Menteng, Jakarta;-61.919.540.000;106.828.573.000;Rp500.000 for two people (approx.) Without alcohol
Wyl's Kitchen - Veranda Hotel At Pakubuwono;['Casual Dining', 'Indonesian'];Gandaria;4.3;956 Reviews;Veranda Hotel At Pakubuwono, Jl. Kyai Maja No. 63, Gandaria, Jakarta 12130;-62.399.460.000;106.785.755.000;Rp200.000 for two people (approx.) Without alcohol
Giyanti Coffee Roastery;['Café', 'Coffee'];Cikini;4.8;1,372 Reviews;Jl. Surabaya No. 20, Cikini, Jakarta;-61.989.270.000;106.839.468.000;Quaint Little Place
Legend of Noodle;['Casual Dining', 'Korean'];Senopati;4.6;1,463 Reviews;Jl. Senopati No. 81, Senopati, Jakarta;-62.332.056.686;106.812.229.603;Service is Great and Fast
Cork & Screw Country Club;['Lounge', 'Casual Dining', 'European', 'Grill', 'Asian'];Senayan;4.1;761 Reviews;Senayan National Golf Club - The Maj Senayan, Jl. Asia Afrika Pintu IX, Senayan, Jakarta;-62.256.045.096;106.797.773.838;Rp600.000 for two people (approx.) with alcohol
Cutt & Grill;['Casual Dining', 'Grill', 'Burger', 'Steak', 'Kebab'];Tebet;4.6;1,210 Reviews;Jl. Tebet Barat Dalam Raya No. 23, Tebet, Jakarta;-62.357.880.000;106.846.870.000;Rp300.000 for two people (approx.)
Kintaro Sushi;['Casual Dining', 'Sushi', 'Japanese'];Senopati;4.7;3,316 Reviews;Jl. Suryo No. 20, Senopati, Jakarta;-62.346.211.665;106.813.008.785;Rp400.000 for two people (approx.)
Kopi Kalyan;['Café', 'Cafe', 'Western', 'Indonesian'];Senopati;4.2;955 Reviews;Jl. Cikajang No. 61, Senopati, Jakarta;-62.433.297.108;106.809.213.124;Rp100.000 for two people (approx.)
Social House;['Casual Dining', 'Italian', 'Japanese'];Thamrin;4.3;2,123 Reviews;Grand Indonesia Mall, East Mall, Lantai 1, Jl. M. H. Thamrin No. 1, Thamrin, Jakarta;-61.951.780.000;106.820.437.000;Great View
Namaaz Dining;['Fine Dining', 'Indonesian'];Senopati;4.9;927 Reviews;Jl. Gunawarman No. 42, Senopati, Jakarta;-62.385.876.732;106.806.963.086;Rp2.400.000 for two people (approx.) Without alcohol
Hokkaido Izakaya;['Casual Dining', 'Japanese', 'Sushi'];Sudirman;4.7;1,134 Reviews;Pavilion Retail Arcade, Lantai Dasar, Jl. K.H. Mas Mansyur Kav. 24, Sudirman, Jakarta;-62.077.490.000;106.817.745.000;Rp350.000 for two people (approx.) Without alcohol
JimBARan Lounge - AYANA Midplaza JAKARTA;['Lounge', 'Bar', 'Asian'];Sudirman;4.1;536 Reviews;AYANA Midplaza JAKARTA, Jl. Jend. Sudirman Kav. 10-11, Sudirman, Jakarta;-62.090.232.960;106.819.872.893;Rp450.000 for two people (approx.) with alcohol
La Vue Rooftop Bar - The Hermitage;['Lounge', 'Casual Dining', 'Finger Food', 'Western'];Cikini;4.2;371 Reviews;The Hermitage, Lantai 9. Jl. Cilacap No. 1, Menteng, Jakarta 10310;-61.982.800.000;106.838.072.000;Rp650.000 for two people (approx.) with alcohol
OKU - Hotel Indonesia Kempinski;['Fine Dining', 'Bar', 'Japanese', 'Sushi'];Thamrin;4.9;933 Reviews;Hotel Indonesia Kempinski, Jl. M. H. Thamrin, Thamrin, Jakarta;-61.956.170.000;106.822.359.000;Rp900.000 for two people (approx.) Without alcohol
Eighty/Nine Eatery & Spirit;['Casual Dining', 'Western', 'Asian'];Kemang;4.2;1,028 Reviews;Jl. Kemang Raya No. 89, Kemang, Jakarta;-62.704.200.000;106.815.768.000;Rp350.000 for two people (approx.)
BART - Bar at The Roof Top - Artotel Jakarta;['Casual Dining', 'Continental', 'Indonesian'];Thamrin;4.0;540 Reviews;Artotel Jakarta, Lantai 7, Jl. Sunda No. 3, Thamrin, Jakarta;-61.888.510.000;106.824.792.000;Rp300.000 for two people (approx.) Without alcohol
Paulaner Brauhaus;['Bar', 'Casual Dining', 'German'];Thamrin;4.6;1,912 Reviews;Grand Indonesia Mall, East Mall, Lantai 2, Jl. M. H. Thamrin No. 1, Thamrin, Jakarta;-61.963.100.000;106.822.536.000;Amazing Food and Experience
Seasonal Tastes - The Westin Jakarta;['Casual Dining', 'Indonesian', 'Indian', 'Western'];Kuningan;4.4;863 Reviews;The Westin Jakarta, Jl. H. R. Rasuna Said, Kuningan, Jakarta;-62.243.216.407;106.833.692.975;Rp500.000 for two people (approx.) Without alcohol
Seirock-Ya;['Casual Dining', 'Japanese', 'Ramen'];Gandaria;4.7;1,571 Reviews;Jl. Ahmad Dahlan no. 22, Gandaria, Jakarta;-62.464.100.000;106.791.743.000;Authentic
Sushi Masa;['Casual Dining', 'Sushi', 'Japanese'];Pluit;4.9;1,544 Reviews;Jl. Tuna Raya No. 5, Pluit, Jakarta;-61.013.300.000;106.800.190.000;Booking
Warung MJS;['Casual Dining', 'Jawa', 'Indonesian'];Setiabudi;4.4;1,223 Reviews;Jl. Setiabudi Tengah No.11, Setiabudi, Jakarta;-62.092.899.434;106.826.593.838;Rp170.000 for two people (approx.)
Bluegrass Bar & Grill;['Bar', 'Casual Dining', 'Grill', 'American', 'European'];Kuningan;4.5;1,020 Reviews;Bakrie Tower, Lantai Ground, Jl. H.R. Rasuna Said, Kuningan, Jakarta;-62.197.300.842;106.834.257.580;Good Food and Good Ambience
Gordi HQ;['Café', 'Coffee'];Cilandak;4.3;658 Reviews;Jl. Jeruk Purut Dalam No. 25, Cilandak, Jakarta 12560;-62.841.950.000;106.811.778.000;Rp150.000 for two people (approx.)
MONKS;['Casual Dining', 'Café', 'Western', 'Asian', 'Cafe'];Kelapa Gading;4.2;908 Reviews;Komplek Graha Boulevard Timur, Summarecon Kelapa Gading, Jl. Boulevard Timur, Blok ND 1 No. 51, Kelapa Gading, Jakarta;-61.640.986.132;106.911.238.655;Rp250.000 for two people (approx.)
Por Que No;['Casual Dining', 'Spanish'];Menteng;4.1;597 Reviews;De Ritz Building, Lantai 5, Jl. HOS. Cokroaminoto No. 91, Menteng, Jakarta;-61.978.970.000;106.828.710.000;Rp350.000 for two people (approx.) Without alcohol
Crematology Coffee Roasters;['Café', 'Casual Dining', 'Coffee', 'Italian', 'Western', 'Desserts'];Senopati;4.2;1,221 Reviews;Jl. Suryo No. 25, Senopati, Jakarta;-62.355.727.176;106.813.828.870;Couple Friendly
Two Stories;['Casual Dining', 'Western'];Bogor Timur;4.1;1,217 Reviews;Jl. Pajajaran Indah V No. 7, Bogor Timur, Bogor;-66.094.410.000;106.812.864.000;Rp200.000 for two people (approx.) Without alcohol
Osteria GIA;['Casual Dining', 'Italian'];SCBD;4.8;452 Reviews;Pacific Place Mall, Lantai Ground, Jl. Jenderal Sudirman, SCBD, Jakarta;-62.250.470.000;106.810.309.000;Rp500.000 for two people (approx.) Without alcohol
Tokyo Skipjack;['Casual Dining', 'Japanese', 'Steak'];Blok M;4.5;1,298 Reviews;Jl. Bulungan Raya No. 16, Blok M, Jakarta;-62.425.880.000;106.795.975.000;Fair Price
Ottoman's Coffee Brewers;['Café', 'Coffee', 'Western', 'Italian'];Kuningan;4.2;826 Reviews;Sopo Del Tower, Lantai Ground, Jl. Mega Kuningan Barat III, Kuningan, Jakarta;-62.312.650.000;106.823.951.000;Rp200.000 for two people (approx.)
dia.lo.gue;['Casual Dining', 'Western', 'Italian', 'Indonesian'];Kemang;3.9;886 Reviews;Jl. Kemang Selatan Raya No. 99A, Kemang, Jakarta;-62.729.090.000;106.816.341.000;Stairs
The Garden;['Casual Dining', 'Fusion', 'Indonesian', 'Japanese', 'Western'];Pantai Indah Kapuk;4.4;1,695 Reviews;Ruko Garden House, Blok B No. 27, Jl. Pantai Indah Kapuk, Pantai Indah Kapuk, Jakarta;-61.104.530.000;106.737.743.000;Rp600.000 for two people (approx.) Without alcohol
Union;['Casual Dining', 'Italian', 'American', 'Desserts'];Senayan;4.5;2,226 Reviews;Plaza Senayan, Lantai Ground, Jl. Asia Afrika, Senayan, Jakarta;-62.243.110.000;106.798.983.000;Best Place
Bansan;['Quick Bites', 'Japanese'];Fatmawati;4.8;921 Reviews;Jl. Cipete Raya No. 65, Fatmawati, Jakarta;-62.777.770.000;106.800.374.000;Rp150.000 for two people (approx.)
Harlequin Bistro;['Casual Dining', 'Western', 'Asian', 'Bakery'];Kemang;4.1;531 Reviews;Jl. Kemang 1 No. 10A-10B, Kemang, Jakarta 12730;-62.579.430.000;106.813.293.000;Rp220.000 for two people (approx.)
Kila Kila by Akasya;['Casual Dining', 'Indonesian'];SCBD;4.3;647 Reviews;Lot 4, Lantai 7, Jl. Jend. Sudirman Kav. 52-53, SCBD, Jakarta;-62.236.030.000;106.810.778.000;Rp450.000 for two people (approx.) Without alcohol
Fujin Japanese Teppanyaki & Sake;['Casual Dining', 'Bar', 'Japanese'];Senopati;4.5;792 Reviews;Jl. Gunawarman No. 21, Senopati, Jakarta;-62.331.393.431;106.807.822.734;Rp400.000 for two people (approx.) Without alcohol
Maple & Oak;['Casual Dining', 'Western'];Menteng;4.3;933 Reviews;De Ritz Building, Lantai Ground, Jl. HOS. Cokroaminoto No. 91, Menteng, Jakarta 10310;-61.980.510.000;106.828.784.000;Rp250.000 for two people (approx.) Without alcohol
The Café - Hotel Mulia;['Fine Dining', 'Indonesian', 'Western'];Senayan;4.9;2,009 Reviews;Hotel Mulia, Jl. Asia Afrika, Senayan, Jakarta;-62.149.550.000;106.797.046.000;Great Veg Options
Segarra;['Casual Dining', 'Lounge', 'Seafood', 'Western', 'Asian'];Ancol;4.2;1,126 Reviews;Taman Impian Jaya Ancol, Jl. Lodan Timur, Ancol, Jakarta;-61.163.100.000;106.858.079.000;Rp750.000 for two people (approx.) Without alcohol
7 Speed Coffee;['Café', 'Coffee', 'Italian', 'Desserts'];Kemang;4.4;594 Reviews;Jl. Kemang Utara Raya No. 33-1, Kemang, Jakarta;-62.578.448.513;106.820.862.628;Rp160.000 for two people (approx.)
Kopi Nalar;['Café', 'Quick Bites', 'Coffee', 'Western'];Senopati;4.3;764 Reviews;Jl. Prof. Joko Sutono No. 7, Senopati, Jakarta;-62.423.175.153;106.807.894.818;Rp170.000 for two people (approx.)
OJJU;['Casual Dining', 'Korean'];Tebet;4.2;3,188 Reviews;Kota Kasablanka, Lantai Upper Ground, Food Society, Jl. Casablanca Raya, Tebet, Jakarta;-62.235.280.000;106.842.437.000;Rp200.000 for two people (approx.)
Loewy;['Casual Dining', 'Bar', 'Western'];Kuningan;4.3;1,196 Reviews;Oakwood, Lantai Ground, Jl. Lingkar Mega Kuningan, Kuningan, Jakarta;-62.274.603.145;106.825.629.249;Great Location
Lewis & Carroll Tea;['Café', 'Casual Dining', 'Coffee', 'Tea', 'Western'];Blok M;4.5;713 Reviews;Jl. Bumi No. 4, Blok M, Jakarta;-62.367.250.000;106.789.863.000;Rp250.000 for two people (approx.)
Sudestada Grill;['Casual Dining', 'Grill', 'South American', 'Bar', 'Cafe'];Thamrin;4.6;488 Reviews;Jl. Irian No. 18, Thamrin, Jakarta 10350;-61.918.470.000;106.824.136.000;Rp250.000 for two people (approx.) Without alcohol
Shabu Ghin;['Casual Dining', 'Japanese'];Senopati;4.4;959 Reviews;Jl. Wolter Monginsidi No. 53, Senopati, Jakarta;-62.390.206.176;106.810.260.862;Rp300.000 for two people (approx.) Without alcohol
Fedwell;['Café', 'Quick Bites', 'Healthy Food'];Senopati;4.6;897 Reviews;Jl. Senopati No. 82, Senopati, Jakarta;-62.327.937.170;106.810.990.087;Rp250.000 for two people (approx.)
Trafique Coffee;['Café', 'Cafe'];Senayan;4.3;851 Reviews;Jl. Hang Tuah Raya No. 9, Senayan, Jakarta;-62.304.010.000;106.797.760.000;Coffeeshop
SKYLOFT - All Seasons Hotel;['Casual Dining', 'Lounge', 'Indonesian', 'Western'];Thamrin;3.9;455 Reviews;All Seasons Hotel, Lantai 14, Jl. Talang Betutu No. 2, Thamrin, Jakarta;-62.014.070.000;106.822.151.000;Rp500.000 for two people (approx.) Without alcohol
BASQUE Bar de Tapas;['Casual Dining', 'Bar', 'Spanish'];Kuningan;4.5;785 Reviews;Noble House Building, Lantai 8, Jl. Mega Kuningan Barat, Kuningan, Jakarta 12950;-62.282.180.000;106.825.387.000;Rp750.000 for two people (approx.) Without alcohol
Kimukatsu;['Casual Dining', 'Japanese'];Tebet;4.3;1,336 Reviews;Kota Kasablanka, Lantai Upper Ground, Food Society, Jl. Casablanca Raya, Tebet, Jakarta;-62.227.890.000;106.842.023.000;Rp200.000 for two people (approx.)
Ruth's Chris Steak House;['Fine Dining', 'Steak'];Karet;4.6;561 Reviews;Somerset Grand Citra, Lantai Ground, Jl. Prof Dr Satrio Kav 1, Karet, Jakarta;-62.248.399.215;106.824.214.384;Rp1.900.000 for two people (approx.) Without alcohol
ONNI House;['Casual Dining', 'Indonesian', 'Japanese'];Tanjung Duren;4.3;1,255 Reviews;Jl Tanjung Duren Utara V No. 242, Tanjung Duren, Jakarta;-61.731.810.000;106.781.495.000;Rp200.000 for two people (approx.)
Tugu Kunstkring Paleis;['Fine Dining', 'Betawi', 'Jawa', 'Western', 'Indonesian'];Menteng;4.7;645 Reviews;Jl. Teuku Umar No. 1, Menteng, Jakarta;-61.888.410.000;106.833.331.000;Rp500.000 for two people (approx.) Without alcohol
Satoo - Shangri-La Hotel;['Fine Dining', 'Indonesian', 'Western'];Sudirman;4.4;1,736 Reviews;Shangri-La Hotel, Jl. Jendral Sudirman Kav. 1, Sudirman, Jakarta;-62.030.536.912;106.818.792.633;Rp550.000 for two people (approx.) Without alcohol
Hello Sunday;['Casual Dining', 'Italian', 'Asian', 'Desserts', 'Coffee'];Cikini;4.4;797 Reviews;Metropole 21 Lantai 2, Jl. Pegangsaan Timur No. 21, Cikini, Jakarta;-62.001.600.000;106.843.646.000;Rp350.000 for two people (approx.) Without alcohol
HONU Poké & Matcha Bar;['Casual Dining', 'Japanese', 'Tea', 'Beverages', 'Healthy Food'];Kemang;4.8;1,071 Reviews;Jl. Kemang Selatan Raya No. 125, Kemang, Jakarta;-62.729.260.000;106.815.732.000;Rp220.000 for two people (approx.)
Benedict;['Casual Dining', 'Western'];Thamrin;4.4;1,379 Reviews;Grand Indonesia Mall, East Mall, Lantai Lower Ground, Jl. M. H. Thamrin No. 1, Thamrin, Jakarta;-61.960.820.000;106.822.120.000;Breakfast Menu
Three Buns;['Casual Dining', 'Burger'];Senopati;4.1;1,290 Reviews;Jl. Senopati No. 90, Senopati, Jakarta;-62.330.173.575;106.811.450.086;Cool Place
Yakinikuya;['Casual Dining', 'Japanese'];Dharmawangsa;4.8;1,196 Reviews;Dharmawangsa Square, Jl. Dharmawangsa VI, Dharmawangsa, Jakarta;-62.534.612.226;106.801.743.507;Rp500.000 for two people (approx.)
Pokenbir;['Casual Dining', 'Asian', 'Western'];Setiabudi;4.9;1,193 Reviews;Lippo Kuningan, Jl. HR Rasuna Said, Setiabudi, Jakarta;-62.175.539.471;106.830.099.821;Rp320.000 for two people (approx.) Without alcohol
Tsamara Resto & Function Hall;['Casual Dining', 'Indonesian'];Pondok Melati;4.1;611 Reviews;Jl. Raya Hankam No. 69, Pondok Melati, Bekasi;-63.414.770.000;106.923.028.000;Rp150.000 for two people (approx.)
Nicole's Kitchen & Lounge;['Casual Dining', 'Western', 'Asian'];Cisarua;4.2;942 Reviews;Kampoeng Brasco, Jl. Raya Hanjawar No. 1, Cisarua, Bogor 43253;-67.139.220.000;107.023.893.000;Good View
Cliq Coffee;['Café', 'Quick Bites', 'Coffee', 'Western', 'Indonesian'];Senopati;4.2;414 Reviews;Jl. Cipaku I No. 9A, Senopati, Jakarta;-62.395.375.506;106.811.348.497;Rp160.000 for two people (approx.)
Jetski Cafe;['Casual Dining', 'Seafood'];Pluit;4.2;791 Reviews;Pantai Mutiara, Jl. Raya Pantai Mutiara, Blok R No. 57, Pluit, Jakarta;-61.034.493.621;106.790.332.384;Sunset View
Gelato Secrets;['Dessert Parlor', 'Ice Cream'];Menteng;4.6;846 Reviews;Shophaus, Lantai 1, Jl. Teuku Cik Ditiro No. 36, Menteng, Jakarta;-61.976.190.000;106.836.528.000;Rp130.000 for two people (approx.)
FEZ Kinara & Aroi Thai;['Casual Dining', 'Bar', 'North Indian', 'Indian', 'Moroccan', 'Middle Eastern', 'Thai'];Kemang;4.3;422 Reviews;Jl. Kemang Raya No. 78 B, Kemang, Jakarta;-62.693.544.925;106.815.876.402;Rp250.000 for two people (approx.) Without alcohol
Mister - Sunday;['Café', 'Cafe', 'Australian', 'Coffee', 'Tea'];Senopati;4.1;673 Reviews;Jl. Cikajang No. 30, Senopati, Jakarta;-62.411.316.744;106.810.323.894;Rp150.000 for two people (approx.) Without alcohol
Goedkoop;['Café', 'Quick Bites', 'Cafe', 'Coffee', 'Belanda'];Bendungan Hilir;4.3;1,152 Reviews;Jl. Bendungan Hilir Raya No. 62, Bendungan Hilir, Jakarta;-62.128.700.000;106.812.781.000;Variety of Pasta
Zenbu;['Casual Dining', 'Sushi', 'Ramen', 'Japanese'];Tebet;4.5;1,511 Reviews;Kota Kasablanka, Lantai Upper Ground, Food Society, Jl. Casablanca Raya, Tebet, Jakarta;-62.242.250.000;106.842.805.000;Ample Seating Area
Pizza Place;['Quick Bites', 'Pizza'];Kemang;4.8;813 Reviews;Como Park, Jl. Kemang Timur Raya No. 998, Kemang, Jakarta;-62.724.860.000;106.821.250.000;Rp100.000 for two people (approx.)
Woodpecker Coffee;['Café', 'Desserts', 'Tea', 'Coffee'];Dharmawangsa;4.2;716 Reviews;Jl. Panglima Polim V No. 23, Dharmawangsa, Jakarta;-62.507.946.333;106.798.142.977;Perfect Place
Tier Siera Resto & Lounge;['Casual Dining', 'Western'];Tanah Sareal;4.0;604 Reviews;Jl. Jend. Ahmad Yani No. 48, Tanah Sareal, Bogor 16161;-65.762.160.000;106.800.238.000;Rp150.000 for two people (approx.)
Foresthree;['Café', 'Cafe', 'Western'];Bogor Utara;4.2;863 Reviews;Jl. H. Achmad Adnawijaya, Bogor Utara, Bogor;-65.777.830.000;106.817.633.000;Rp150.000 for two people (approx.)
Sana Sini Restaurant - Pullman Jakarta Indonesia;['Fine Dining', 'Japanese', 'Chinese', 'Western', 'Indonesian'];Thamrin;4.7;840 Reviews;Pullman Jakarta Indonesia, Jl. M.H. Thamrin 59, Thamrin, Jakarta;-61.936.040.000;106.823.753.000;Intimate Setting
Yakiniku Kintan Buffet;['Casual Dining', 'Japanese'];Gandaria;4.5;1,263 Reviews;Gandaria City, Lantai Upper Ground, Jl. Sultan Iskandar Muda, Gandaria, Jakarta;-62.430.950.000;106.783.823.000;Rp600.000 for two people (approx.)
Jjang Korean Noodle; ['Casual Dining', 'Korean', 'Grill & Chikin’'];Senopati;4.2;705 Reviews;Jl. Wolter Monginsidi No. 37, Senopati, Jakarta;-62.390.952.746;106.808.573.082;Portions
Parc 19;['Casual Dining', 'Lounge', 'Western', 'Asian'];Kemang;4.2;574 Reviews;Jl. Taman Kemang No. 19, Kemang, Jakarta;-62.559.260.000;106.810.325.000;Live Music
Sophie Authentique;['Casual Dining', 'Bakery', 'French', 'Coffee', 'Desserts', 'Bakery'];Fatmawati;4.2;429 Reviews;Jl. Cipete Raya No. 11, Fatmawati, Jakarta;-62.779.998.041;106.801.886.335;Bread
Al Jazeerah Signature;['Casual Dining', 'Arabian', 'Middle Eastern'];Menteng;4.3;495 Reviews;Jl. Johar No. 8, Menteng, Jakarta;-61.871.770.000;106.831.998.000;Rp500.000 for two people (approx.)
Happiness Kitchen & Coffee;['Café', 'Coffee', 'Western'];Jagakarsa;4.0;739 Reviews;Jl. M. Kahfi 1 No. 36A, Jagakarsa, Jakarta;-63.302.290.000;106.808.964.000;Rp120.000 for two people (approx.)
B'Steak Grill & Pancake;['Casual Dining', 'Steak', 'Grill'];Serpong Utara;4.4;1,087 Reviews;Ruko Golden 8, Jl. Ki Hajar Dewantara, Blok F No. 3, Serpong Utara, Tangerang 11151;-62.396.430.000;106.637.187.000;Rp300.000 for two people (approx.) Without alcohol
Langit Seduh - Takes Mansion & Hotel;['Café', 'Coffee', 'Indonesian', 'Snacks'];Tanah Abang;3.2;356 Reviews;Takes Mansion &amp;;;Rp150.000 for two people (approx.)
Ecology Bistro and Lounge;['Casual Dining', 'Lounge', 'Western'];Kemang;4.1;406 Reviews;Jl. Kemang Raya No. 6, Kemang, Jakarta 12730;-62.565.147.357;106.814.536.303;Rp150.000 for two people (approx.)
Seribu Rasa;['Casual Dining', 'Seafood', 'Jawa', 'Peranakan'];Thamrin;4.5;656 Reviews;Jl. Haji Agus Salim No. 128, Thamrin, Jakarta;-61.954.940.000;106.824.827.000;Rp500.000 for two people (approx.) Without alcohol
BYURGER;['Quick Bites', 'Burger'];Fatmawati;4.4;638 Reviews;Jl. Antasari Raya, Pasar Cipete Selatan No. 10, Fatmawati, Jakarta;-62.788.680.000;106.807.926.000;Rp400.000 for two people (approx.) Without alcohol
FJ On 7;['Lounge', 'Asian', 'Western'];Kemang;4.0;632 Reviews;Colony 6, Rooftop, Jl. Kemang Raya No. 6A, Kemang, Jakarta;-62.553.880.000;106.810.357.000;Rp100.000 for two people (approx.)
Holy Smokes;['Casual Dining', 'Grill', 'Steak'];Senopati;4.4;1,441 Reviews;Jl. Wolter Monginsidi No. 27, Senopati, Jakarta;-62.389.300.000;106.807.761.000;Rp400.000 for two people (approx.) with alcohol
Gurih 7;['Casual Dining', 'Sunda', 'Jawa', 'Indonesian'];Bogor Utara;4.2;1,925 Reviews;Jl. Raya Pajajaran No.102, Bogor Utara, Bogor 16153;-65.739.320.000;106.807.550.000;Rp500.000 for two people (approx.) Without alcohol
Fillmore Coffee;['Café', 'Cafe'];Setiabudi;4.4;477 Reviews;Suites@ Seven, Jl. H. Sidik No. 7, Setiabudi, Jakarta;-62.206.663.304;106.823.557.913;Rp250.000 for two people (approx.)
Kedai Filosofi Kopi;['Café', 'Coffee'];Melawai;4.1;985 Reviews;Jl. Melawai 6, Melawai, Jakarta;-62.448.578.322;106.799.778.454;Rp150.000 for two people (approx.)
Sumibi Japanese Restaurant;['Casual Dining', 'Japanese'];Gandaria;4.6;604 Reviews;1 Park Residences, Jl. KH. M Syafi'i Hadzami No. 1, Gandaria, Jakarta;-62.457.690.000;106.788.394.000;Rp100.000 for two people (approx.)
Sushi Go!;['Food Court', 'Sushi', 'Japanese'];Thamrin;4.5;3,818 Reviews;Grand Indonesia Mall, Lantai 5, FoodPrint, West Mall, Jl. MH Thamrin, Thamrin, Jakarta;-61.950.580.000;106.820.135.000;Rp300.000 for two people (approx.) Without alcohol
